"""जय श्रीराम"" चे नारे देत सार्वजनिक शौचालयाची तोडफोड, बजरंग दलाच्या कार्यकर्त्यांनी केली नासधूस"
लग्नातली भेट अजून सांभाळली! बायडेन आता कधीच चालवू शकणार नाहीत Corvette कार
प्रेमापोटी लाकडापासून साकारली बाईक | Kerala Designer Makes Wooden Bullet Bike Using Teak Wood |India
"मराठी कलाकारांचे आयुष्यही झाले ""न्यू नॉर्मल"", चिराग पाटीलने शेअर केला हा खास फोटो"
अॅमेझॉनला मोठा झटका! रिलायन्स-फ्यूचर ग्रुपच्या कराराला सेबीची मंजुरी
IND vs ENG : टीम इंडियाला धक्का; दुखापतीमुळे अष्टपैलू खेळाडूची संपूर्ण मालिकेतूनच माघार!
नादखुळा! जो भाऊ अन् कमला अक्का तुमचं अभिनंदन! पुण्यातला 'तो' बॅनर जगभर व्हायरल
"'अंतिम'चे शूटिंग संपवून सलमान खान सुरु करणार 'टायगर-3'चे शूटिंग, कतरिना कैफ दिसणार या भूमिकेत"
"फूड समजून शेणाच्या गवऱ्याच मागवल्या, टेस्ट करुन लिहिलेला अभिप्राय व्हायरल"
कोरोनाकाळात वाशिम जिल्ह्यात लहान मुलांच्या मृत्यूचे प्रमाण घटले
"अभिनेत्री आर्या वोराने केली दुबईची सफर, फिरली खाजगी विमान आणि बोटीतून, एकदा तिचे फोटो बघाच !"
राजेश टोपेंनी तत्काळ राजीनामा द्यावा | BJP Atul Bhatkhalkar On Rajesh Tope | Maharashtra News
"'मोहब्बतें'मधून एकारात्री स्टार झाली किम शर्मा, युवराज सिंगसोबतच्या अफेअरमुळे होती चर्चेत"
तू माझा आजही हिस्सा आहेस म्हणत सुशांत सिंग रजपूतच्या बहिणीने शेअर केली भावुक पोस्ट
Explained : जाणून घ्या भारतात बंदीनंतरही कसं वापरलं जातंय TikTok
ग्रामपंचायत निवडणूक निकालानंतर दोन गटातील हाणामारीत एक गंभीर जखमी
"आता बाजार समिती, सोसायट्यांच्या निवडणुकीचे वेध"
धक्कादायक ! वरिष्ठांच्या त्रासाला कंटाळून विष घेतलेल्या ग्रामसेवकाचा उपचारादरम्यान मृत्यू
दिलासादायक! लसीशिवायही 'या' उपायाचा व्यापक वापर कोरोनाला पूर्णपणे रोखणार; वैज्ञानिकांचा दावा
खामगावातील भूखंड घोटाळा: आणखी तिघांना अटक
"२८ वर्षीय तरूणाने उंची वाढण्यासाठी केला हा कारनामा, २ इंचासाठी आलेला खर्च वाचून व्हाल अवाक्..."
सोनू सूदला उच्च न्यायालयाचा तगडा झटका; बेकायदा बांधकामावरील आव्हान याचिका फेटाळली
"Video : ढोल ताशांचा गजर, लेकीची गळाभेट... असं झालं अजिंक्य रहाणेचं मुंबईत जंगी स्वागत"
"""जनतेच्या सुरक्षिततेसाठी लसीची खूप गरज पण लस मिळवण्याच्या स्पर्धेत आम्ही टिकणार नाही, आम्हाला... ""; ""या"" देशाचं मोदींना पत्र"
अंधश्रद्धेवर गुरुमाऊलींचे अप्रतिम प्रवचन | Excellent Guidance on superstition by Gurumauli Annasaheb
श्री कृष्णांचा जीवनादर्श कसा पाळावा? How to take Inspiration from life of Shri Krishna? Gurumauli
"बुलडाणा जिल्ह्यातआणखी दाेघांचा मृत्यू, ५२ पाॅझिटिव्ह"
तुला लाज कशी वाटत नाही? कंगनाचे ट्वीट्स वाचून संतापले सुशांत सिंग राजपूतचे चाहते250
"पतीला एका ब्लाइंड डेटवर भेटल्या होत्या कमला हॅरिस, ते काय करतात आणि किती आहे त्यांची संपत्ती?"
Inauguration Day: बायडेन यांचा शपथविधी... पण चर्चा लेडी गागाच्या लूकचीच
"पंतप्रधान, मुख्यमंत्री, लोकप्रतिनिधींना कधी देणार कोरोना लस? जाणून घ्या"
"""जनतेच्या सुरक्षिततेसाठी लसीची खूप गरज पण लस मिळवण्याच्या स्पर्धेत आम्ही टीकणार नाही, आम्हाला... ""; ""या"" देशाचं मोदींना पत्र"
ग्राम पंचायत निवडणुकीचा खर्च सादर करण्यासाठी उमेदवारांची धावपळ
जीवनात आदर्श कसा शोधायचा? How to find an Ideal Person in life? Annasaheb More | Lokmat Bhakti
मुंबईत परतलेल्या टीम इंडियाचे शिलेदार होम क्वारंटाईन; MCA कडून सत्कार
"तो सध्या काशी-बनारस फिरतोय, टीम इंडियाचा गब्बर गंगा आरतीत तल्लीन "
"परत ये...! सुशांत सिंग राजपूतच्या वाढदिवशी चाहते भावूक, संदेश वाचून तुमच्याही डोळ्याच्या कडा पाणावतील"
"बायडन आणि कमला हॅरिस यांचा शपथविधी | US Election Result | Joe Biden, Kamala Harris Inauguration"
भगव्याचा हिरवा रंग कुणी केला? Atul Bhatkhalkar On Shivsena | Salman Hashmi | Maharashtra News
पुण्यात मोठ्या राजकीय घडामोडीचे संकेत | 19BJP Corporator's join NCP? Ajit Pawar | Girish Bapat
अजितदादांच्या ट्वीटमुळे हा वाद झाला? Uddhav Thackeray's Speech In 31st State Road Safety Inaguration
"मस्तच! आता Aadhar Card शिवाय देखील मिळेल LPG Cylinder वर सबसिडी, फक्त करावं लागणार ""हे"" काम "
IPL 2021 Auction : ३९ स्वदेशी अन् २२ परदेशी खेळाडूंवर लागेल १९६ कोटींपर्यंत बोली; जाणून घ्या प्रत्येक संघाकडे किती रक्कम
"गणपतीपुळेला गेलेल्या कारचा अपघात; पोलिस कर्मचाऱ्याची पत्नी जागीच ठार, चौघे जखमी"
"कोविड लसीकरण : पहिला दिवस उत्साहाचा, आता वाढली धाकधूक!"
कोरोना लसीकरणासाठी अकोल्यात ८२ ‘आयएलआर’ दाखल!
रेणुका शहाणेंचा अभिनेत्री ते दिग्दर्शिकेपर्यंतचा प्रवास | Renuka Shahane | Lokmat CNX Filmy
Indian Idol स्पर्धक सवाई भट्टची कहाणी खरी की खोटी?Sawai Bhatt Indian Idol 2020 | India Idol Season12
दीपाली सय्यद व सीमा कदम यांचं मानसीला मार्गदर्शन | Deepali Sayed | Manasi Naik Wedding | Seema Kadam
बायडेन धमाका! शेअर बाजारात मोठी उसळी; सेन्सेक्स पहिल्यांदाच 50000 पार
मिनी विंटर! मुंबईकरांना पुन्हा एकदा थंडीची चाहूल; १८.२ अंश तापमानाची नोंद
"'धक्के पे धक्का'! ममता बॅनर्जींना आणखी एक मोठा झटका, आमदार अरिंदम भट्टाचार्य यांचा भाजपामध्ये प्रवेश"
पोलिसाकडून पोलीस शिपाई महिलेवर बलात्कार; दादर भोईवाडामधील धक्कादायक घटना1195
'या' देशात फिरायला भारतीयांना लागत नाही Visa | Top Five Countires Indians Can Travel Without Visa
अकाेला मनपातील गैरकारभाराच्या चाैकशीसाठी चार सदस्यीय समिती
फोनमधून Delete झालेले फोटो व व्हिडीओ कसे मिळतील?How To Recover Deleted Photos & Videos In Your Cell?
आरोग्य विभागाच्या पद भरतीपासून मुकणार नव्याने इच्छुक उमेदवार!
"डोनाल्ड ट्रम्पचं राष्ट्राध्यक्ष जो बायडन यांच्यासाठी 5 शब्दांचं पत्र व्हायरल, जाणून घ्या सत्य"
जागतिक वारसा लाभलेली भारतातील पाच ऐतिहासिक स्थळं | Top Five UNESCO Sites In India | Lokmat Oxygen
"नालासाेपारा येथे नायजेरियन नागरिकांची धरपकड, १४ जणांना अटक ; तुळिंज पाेलिसांची शाेधमाेहीम "
येडीयुराप्पांच्या मागे लागलीय सहस्यमयी CD; कर्नाटक भाजपात बंडाचे वारे
"महापालिकेच्या प्रशासनाशी सत्ताधारी भाजपचे बिनसले?; महापौरांनी सभा केली तहकूब, प्रश्नांना उत्तरे मिळत नसल्याचा आरोप"
'गब्बर को किस बात की मिली सजा'; पोलिसांच्या भन्नाट ट्वीटची चर्चा
IPL 2021 : मुंबई इंडियन्सनं रिलीज केल्यानंतर लसिथ मलिंगानं घेतला मोठा निर्णय; समोर आलं खरं कारण!
थकीत वीज बिलाच्या कारवाईबाबत नाराज; रोहित पवारांनी सरकारलाच विचारले सवाल 
बाबो! 'या' व्यक्तीला आहेत २७ बायका अन् १५० मुलं-मुली; मुलगा सांगतोय या विशाल फॅमिलीचे किस्से...
"आरोग्य अधिकाऱ्यावर महापौर संतप्त, महासभेत निघाले आरोग्य विभागाचे वाभाडे"
शाकंभरी नवरात्रीनिमित्त महिषासुरमर्दिनी स्तोत्रातील श्लोकांचा भावार्थ!
"अर्नाळा ते कर्नाळा समुद्रात बोटी नांगरून आज आंदोलन, पालघर, ठाणे, रायगड जिल्ह्यातील मच्छीमार-प्रकल्पग्रस्त एकवटले"
"बायडेन यांनी शब्द पाळला; पदभार स्वीकारताच हवामान बदल, WHO, कोरोनाबाबत ट्रम्प यांचे 'ते' निर्णय घेतले मागे"
बायडेन यांनी शपथ घेताच चीनने ट्रम्प टीमविरोधात उचलले मोठे पाऊल..
बायडेन यांनी शपथ घेताच चीनने ट्रम्प टीमविरोधात उचलले मोठे पाऊल...
"राज्य लोकसेवा आयोगाच्या शपथपत्रावर मुख्यमंत्री संतप्त, मंत्र्यांचाही हल्लाबोल; तर अर्ज मागे घेणार, चौकशी होणार"
"गृहमंत्र्यांची मोठी घोषणा, कोरोना लॉकडाऊनमधील दाखल गुन्हे मागे घेणार"
Good News; सोलापूर शहरातील इयत्ता ९ वी पासूनचे कोचिंग क्लासेस सुरू करण्यास परवानगी
राजकारण्यानो सावधान! राजकीय कूस बदलतेय...
"100 इलेक्ट्रिक बसचे कंत्राट सापडले वादात; बस देण्यास विलंब, कंत्राट रद्द करण्याचा निर्णय"
"एनआरसी वसाहतीच्या पाडकामास कामगारांचा विरोध; पोलिसांकडून लाठीचार्ज, २५ जणांना घेतले ताब्यात"
"अवघ्या टाटा समुहाला दानशूरपणाचा वसा देऊन गेले, अल्पायुषी सर रतन टाटा...2423"
मुंबई विद्यापीठाचा दीक्षांत समारंभ १ फेब्रुवारीला
"सर्व्हरच बंद पडल्याने लसीकरणात अडचणी, ३६,७३८ जणांना लस - आरोग्य मंत्री टोपे"
"तुमच्यासोबत काम करण्यास उत्सुक, मोदींकडून जो बायडन अन् कमला हॅरिसचं अभिनंदन"
"दिशा पटानी समुद्र किनारी शॉर्ट ड्रेसमध्ये दिसली खूप ग्लॅमरस, फोटो पाहून चाहते झाले क्लीन बोल्ड920"
"राज्यातील महाविद्यालये सुरू करण्याचा निर्णय अद्याप नाहीच; विद्यार्थी, शिक्षणसंस्थांना सरकारी निर्णयाची प्रतीक्षा"
"""गोस्वामींविरोधातही भाजप जागोजागी गुन्हे दाखल करणार असतील तर खरे मर्द"""
बॉलिवूड ड्रग्ज कनेक्शन : अर्जुन रामपालला एनसीबी पुन्हा चाैकशीसाठी बाेलाविणार!
"मुंबईतील शाळा सुरू करण्याच्या कार्यवाहीवरून संभ्रमाचे वातावरण, अंतिम निर्णय आयुक्त, जिल्हाधिकाऱ्यांचाच"
"‘त्या’ तरुणी कास्टिंग काउचच्या शिकार, कास्टिंग डायरेक्टरसह तिघांना अटक, सीआययूची कारवाई"
या बाळांनो सारे या ! दोन तपांपासूनचा रिवाज
आजचे राशीभविष्य - 21 जानेवारी 2021 : घरगुती वापराचे नवीन साहित्य खरेदी कराल
"राज्यात तीन सत्रांत ५१ हजार ६५० कर्मचाऱ्यांना लस, दिवसभरात १८,१६६ लाभार्थ्यांनी घेतला डोस"
Sushant Singh Rajput Birth Anniversary : या चित्रपटांनी बनवले सुशांत सिंग रजपूतला सुपरस्टार
"बेडशीटच्या ऑर्डरच्या बदल्यात अमेरिकेला पाठवले दगड; चौघांना अटक, एक कोटी ९२ लाखांचा ऐवज जप्त"
"यादीत नाव नसले तरी कोणत्याही केंद्रावर लस घेता येणार, तिसऱ्या दिवशी ५२ टक्के कर्मचाऱ्यांचे लसीकरण"
"प्राजक्ता शिंदेचे फोटो पाहून बसेल ४४० व्होल्टचा झटका, बोल्डनेसमध्ये सनी लियोनीला देखील टाकते मागे2070"
"आजचा दिन लोकशाहीचा, एकजूट होऊ या...; अमेरिकेचे नवीन राष्ट्राध्यक्ष बायडेन यांचे आवाहन"
"आता अण्णा हजारे म्हणणार, 'लावा रे तो व्हिडीओ'; मोदी सरकारविरोधात 'उपोषणास्त्र'"
"देशात पाच दिवसांत ७.८६ लाख लोकांनी घेतली लस, लसीकरणानंतर चौघांचा मृत्यू"
"मराठा आरक्षण : औरंगाबादेत विष पिऊन मराठा तरुणाचा आत्महत्येचा प्रयत्न, रुग्णालयात दाखल; प्रकृती स्थिर"
"संधी : माहिती तंत्रज्ञानामध्ये मिळणार ९१ हजार नोकऱ्या, प्रमुख कंपन्यांनी जाहीर केली माहिती"
"मोबाइल पेमेंटच्या वापरात भारताने घेतली आघाडी, जगात पटकावले तिसरे स्थान"
सोन्याच्या भावात वाढ; चांदी मात्र घसरली
पथनाट्य अर्जासाठी आज अंतिम मुदत
मजुरांनी आधार लिंक खात्याची माहिती सादर करावी
धाबेकर महाविद्यालयात रक्तदान शिबिर उत्साहात
जि.प. स्थायी समितीच्या सभेत विविध विषयांवर चर्चा
खाद्यतेलाचा दर पोहोचला १३० रुपये प्रतिकिलोवर
जिल्ह्यात आणखी सात कोरोना पॉझिटिव्ह
मालिका विजयाने दिली अडथळ्यांवर मात करण्याची प्रेरणा
"टीम इंडियाची कामगिरी ऐतिहासिक, रोमहर्षक, अविस्मरणीय..."
ग्रा.पं. सरपंच पदाच्या आरक्षणाकडे लक्ष !
सुरक्षा रक्षकांचे आंदोलन दुसऱ्या दिवशी सुरूच ()
नालासाेपाऱ्यात सेक्स रॅकेटचा पर्दाफाश
सलग तिसऱ्या दिवशी ६० कर्मचाऱ्यांना लसीकरण
"विजयामुळे बदलले ‘ड्रेसिंग रूम’चे समीकरण, ‘फॅब फोर’चे महत्त्व वाढले; कोहलीच्या नेतृत्वाला धोका नाही"
"भारतच नव्हे, अख्खं जग तुम्हाला ‘सॅल्यूट’ करेल! रवी शास्त्रींनी वाढविलं मनोधैर्य; खेळाडू, सपोर्ट स्टाफचं केलं कौतुक"
कोविन ॲपमध्ये तांत्रिक समस्या कायम
विकसित भूखंड वाटपासाठी जेएनपीटीचा सिडकोबरोबर सामंजस्य करार
"राज्यात गेल्यावर्षी रस्ते अपघातामध्ये ११,४५२ जणांचा मृत्यू"
व्यवस्थापन परिषद सदस्यांचा कुलपतींच्या विद्यापीठातील हस्तक्षेपाला विरोध
राज्यात तीन सत्रांत ५१ हजार ६५० कर्मचाऱ्यांना लस
एनआरसी वसाहतीच्या पाडकामास कामगारांचा विरोध
३५ वर्षांनंतर सिलेझरीत भाजपचा पराभव
शेकडो अनुकंपाधारक नोकरीपासून वंचित ()
कोरोनाला लागली उतरती कळा
सुदृढ राहण्यासाठी आरोग्याची काळजी घ्या ()
भुमिगत विद्युत वाहिनीचा प्रश्न ट्रॅकवर ()
"IPL 202: स्मिथची उचलबांगडी, सॅमसन राजस्थान रॉयल्सचा कर्णधार, रैना सीएसकेत कायम; अशी आहे संघांची यादी"
"केंद्र सरकारला घेरण्याची काँग्रेस पक्षाची तयारी, विरोधी पक्षांशी बोलून रणनीती ठरवणार"
"चौकशीत दोषी आढळले, तर धनंजय मुंडेंवर कारवाई; पवारांचं स्पष्टीकरण"
"अमेरिका : एक कोटी स्थलांतरितांना नागरिकत्व मिळेल, पाच लाख भारतीयांना होणार फायदा"
"उपचाराधीन कोरोना रुग्णांची संख्या 2 लाखांपेक्षा कमी, बरे झाले १ कोटी २ लाख रुग्ण; मृत्यूदर १.४४ टक्के"
जो बायडेन यांनी बायकोला 5 वेळा केलं होतं प्रपोज!; असे आहेत त्यांच्या व्यक्तीगत आयुष्यातील गंमतीदार किस्से
मोदींनी योगी आदित्यनाथांना दिली खास भेट! राजकीय क्षेत्र बुचकळ्यात...!
