भय इथले संपत नाही! चीनमध्ये पुन्हा कोरोनाचं संकट; रुग्णसंख्येत वाढ झाल्याने चिंतेत भर
"गुड न्यूज का? दीपिका पादुकोणने शेअर केला फोटो, सोशल मीडियाने पुन्हा केला कहर"
"कजगाव येथील डाॅक्टरांच्या गाडीला अपघात, चाैघे जखमी"
युवकांनी युवकांसाठी चालविलेला अनोखा उपक्रम
"सूर्योपासना करा आणि फरक अनुभवा, शिवाय भरघोस फायदेही मिळवा."
रामायणवर बनणार सिनेमात ह्रतिक रोशन प्रभू रामाची नव्हे तर रावणाची भूमिका साकारणार ?
"अर्थमंत्र्यांचं भाषण संपताच सोन्याच्या दरात तब्बल १,२०० रुपयांची घसरण, जाणून घ्या लेटेस्ट दर"
"हा अर्थसंकल्प होता की OLX, सरकार सर्वकाही विकण्याच्या तयारीत; CPM नेत्याची टीका"
"Budget 2021, Nitin gadkari : 'ऐतिहासिक अर्थसंकल्प, स्क्रॅप पॉलिसीमुळे देशात 50 हजार नवे जॉब'"
Budget 2021: क्या ये सो रहा है! अर्थमंत्र्यांनी बजेट सादर केलं अन् दुसरीकडे व्हायरल झाला राहूल गांधींचा फोटो
"भिवंडीत गोदाम इमारत कोसळली; १ मृत्यू तर ६ जखमी, ढिगाऱ्याखाली ४-५ जण अडकल्याची शक्यता"
माझं संपूर्ण जग एका फ्रेममध्ये!; लेकीच्या फोटोवरील विराट कोहलीच्या कमेंटनं  जिंकली मनं
... तर शरद पवार यांच्यावर टीका-टिप्पणी करण्याशिवाय पर्याय नाही: भाजप नेत्याची कबुली 
"ना राष्ट्रवादी, ना भाजप, खडसे समर्थकांचा नवा गट"
"बलात्काराची खोटी तक्रार करणं महागात, भरावा लागणार 'इतका' दंड "
"कारचे अ‍ॅव्हरेज कमी झालेय का? या ट्रिक फॉलो करा, 10 टक्के जास्त मिळवा..."
"Budget 2021, Shiv sena: खिशात नाही आणा अन् बाजीराव म्हणा, अर्थसंकल्पावर राऊतांचा घणाघात"
सुपरस्टार झाल्यानंतरही लाइन लावून कॉमन टॉयलेटमध्ये जायचा हा अभिनेता
हा अर्थसंकल्प म्हणजे संकटाचे संधीत रूपांतर करण्याचा केलेला निर्धार : केशव उपाध्ये
"Budget 2021, Defence: संरक्षणावर भारतासह ‘हे’ १० देश करतात सर्वाधिक खर्च; पाहा चीन अन् रशियाचा नंबर कितवा?"
हॅलो... मोदींचा नंबर मिळेल का? 'हेल्पलाइन'वर संपर्क साधून सामान्यांची विचारणा
"Budget 2021: सरकारनं लडाखसाठी उघडला पेटारा, जम्मू-काश्मीरसाठीही केली खास घोषणा"
"बजेटचं भाषण संपताच सोन्याच्या दरात तब्बल १,२०० रुपयांची घसरण, जाणून घ्या लेटेस्ट दर"
कबुतरावरून शेजाऱ्यांमध्ये झालं कडाक्याचं भांडण अन् हत्या करून घेतला बदला
"Budget 2021: ""नाशिक मेट्रोचे मॉडेल स्वीकारले ही आनंदाची बाब""; फडणवीसांकडून नागपूर, नाशिककरांचं अभिनंदन"
किम जोंग उनची पत्नी गेल्या एक वर्षापासून गायब? लोक विचारू लागले आहेत प्रश्न....
"श्रीगणेश जयंती, रथसप्तमी, छत्रपती शिवाजी महाराज जयंती; 'हे' आहेत फेब्रुवारीतील मुख्य सण-उत्सव"
 ‘वानप्रस्था’कडे प्रवास सुरु...! अतुल कुलकर्णी यांनी घेतली ‘निवृत्ती’
"Budget 2021: ""अर्थसंकल्प म्हणजे ३० कोटी भारतीयांना उभारी देणारा अन् आत्मनिर्भर भारत संकल्प पूर्ण करणारा"""
Budget 2021: तिजोरी भरण्यासाठी मोदी सरकार काय काय विकणार?; पाहा संपूर्ण यादी
ओव्हेरियन कॅन्सरचं कारण ठरू शकतं वजन वाढणं; महिलांनी 'या' लक्षणांकडे वेळीच द्यायला हवं लक्ष
"कोरोनाच्या संकटात ""या"" देशांसाठी भारत ठरला देवदूत, लसीचे लाखो डोस केले गिफ्ट "
"Budget 2021, Home Loan: गृहकर्ज घेणाऱ्यांसाठी आनंदाची बातमी; Interest Payment सवलतीला १ वर्षाची मुदतवाढ"
"Budget 2021, Costly vs Cheap Live : काय झालं स्वस्त? काय महाग?"
"Budget 2021, Nirmala Sitharaman: मागे पडलेल्यांनी जिंकून दाखवलं; टीम इंडियाच्या पराक्रमाचं उदाहरण वित्तमंत्री देतात तेव्हा..."
Budget 2021 Share Market: वाढता वाढता वाढे... मोदी सरकारच्या बजेटनं शेअर बाजाराला 'बुस्टर डोस'
"Budget 2021, Education : देशात 100 नवीन सैनिक स्कुल, बजेटमध्ये शिक्षण धोरणाचा मनापासून स्विकार"
"मोठी बातमी! डिझेलवर 4, पेट्रोलवर 2.5 रुपयांचा कृषी सेस; महागाईचा भडका उडणार?"
पोलिस राखणार सामाजिक बांधिलकी; ठाणे वाहतूक शाखेतर्फे रक्तदान आणि नेत्र तपासणी शिबिर
Budget 2021 Live : मोबाईलच्या किंमती महागण्याची शक्यता; कस्टम ड्युटीत झाली वाढ
असले चाळे करू नकोस...! ‘तुला पाहते रे’ फेम गायत्री दातारचे हे फोटो पाहून चाहतेही झालेत थक्क
"Budget 2021, Automobile sector: मोठी बातमी! डिझेलवर 4, पेट्रोलवर 2.5 रुपयांचा कृषी सेस; महागाईचा भडका उडणार?"
नाशिककरांना खूशखबर! मेट्रोला मंजुरी! नागरीकांकडून स्वागत
माळशेज घाटात खासगी बस पलटी होऊन भीषण अपघात; २ ठार तर १८ जखमी 
जयंत पाटील यांची दीक्षाभूमीला भेट
अक्षम्य! चिमुकल्यांना पोलिओ डोजऐवजी पाजले सॅनिटायझर
दीर्घायुष्य हवंय ? मग 'या' आहारपद्धतीचा अवलंब करा.
पोलिसांनी राखली सामाजिक बांधिलकी; ठाणे वाहतूक शाखेतर्फे रक्तदान आणि नेत्र तपासणी शिबिर
"Budget 2021, Home Loan: घरकर्ज घेणाऱ्यांसाठी आनंदाची बातमी; Interest Payment सवलतीला १ वर्षाची मुदतवाढ"
"Budget 2021 Live : अर्थमंत्र्यांकडून मोठ्या रिफॉर्म्सची घोषणा, ७५ वर्षांपेक्षा अधिक वयाच्या पेन्शनधारकांना ITR मधून मुभा"
"Budget 2021, Income Tax Slabs : करदात्यांना दिलासा नाहीच; 'इन्कम टॅक्स स्लॅब' जैसे थे!"
"Budget 2021: बंगाल निवडणुकीवर लक्ष?; जेव्हा सितारमण यांनी केला टागोरांच्या ओळीचा उल्लेख, विश्वास एक असा पक्षी आहे..."
"Budget 2021, Agriculture : 'मोदी सरकार शेतकऱ्यांच्या हितासाठी वचनबद्ध, गहू उत्पादकांना ७५,०६० कोटींची मदत!'"
"देशात 100 नवीन सैनिक स्कुल, बजेटमध्ये शिक्षण धोरणाचा मनापासून स्विकार"
विद्यापीठ व्यवस्थापन परिषदेच्या दोन जागांकरिता निवडणूक रिंगणात सात जण
Budget 2021 Automobile Sector: गाडी खरेदीच्या विचारात असलेल्यांसाठी गुड न्यूज; खिशावरचा ३०% भार हलका होणार
"मनोज तिवारींनी लॉकडाऊनमध्ये गुपचूप केलं होतं दुसरं लग्न, वयाच्या 50 व्या वर्षी दुसऱ्यांदा झाले मुलीचे वडील125"
विद्यार्थ्यांप्रमाणे प्राध्यापकांनाही ऑनलाईन वर्ग; १५ कोर्ससाठी लॉकडाऊनमध्ये उदंड प्रतिसाद
वॉर्ड आरक्षणासंदर्भात औरंगाबाद महापालिकेने शपथपत्र दिल्लीला पाठविले
यवतमाळ जिल्ह्यातील मांडवी शिवारात पाच वाघ कॅमेऱ्यात झाले कैद
Vamika Meaning: ... म्हणून विराट-अनुष्का यांनी कन्येचं नाव 'वामिका' असं ठेवलं!
Budget 2021 Live : पेन्शनधारकांसाठी खूशखबर; अर्थमंत्र्यांनी केली मोठी घोषणा
आता आंदोलन करणाऱ्या शेतकऱ्यांना शरद पवारांनी 'हा' सल्ला द्यायला हवा : चंद्रकांत पाटील 
नीता अंबानी शाळेत जातांना त्यांच्या मुलांना किती पॉकेट मनी द्यायच्या? तुमचा विश्वास बसणार नाही...
"शरजील उस्मानीचे वक्तव्य तपासल्यानंतरच कारवाई करू, गृहमंत्र्यांची नागपुरात माहिती"
सीसीआय कापूस खरेदी केंद्रातील गर्दी ओसरली
"करिना, दीपिकाला भावली मोदींची ‘मन की बात’, महिलांचे केले कौतुक"
विमा क्षेत्रातील FDI ४९ टक्क्यांवरुन ७४ टक्क्यांवर; निर्मला सीतारामन यांची घोषणा
Budget news 2021: मामीनं दिलेल्या लाल कापडात निर्मला सीतारामन यांनी सादर केलं होतं पहिलं बजेट; हळदी कुंकवानं लिहिलं होतं शुभ लाभ
Budget 2021 live : विमा क्षेत्रातील FDI ४९ टक्क्यांवरुन ७४ टक्क्यांवर; निर्मला सीतारामन यांची घोषणा
तुमचा जन्म फेब्रुवारीचा आहे? मग हे आहेत तुमचे दोष आणि गुण!
Budget 2021 Live : वाहनांचे सुटे भाग महागणार; 'स्वदेशी' मोबाईल स्वस्त होणार
"सात अहवाल पॉझिटिव्ह, मृत्यू नाही"
निम्न ज्ञानगंगा प्रकल्पाचे पाणी रोखण्याचा प्रयत्न
"वयाच्या 84 वर्षांतही सळसळता उत्साह आणि जोष आजही कायम, धर्मेंद्र यांचा हा व्हिडीओ होतोय व्हायरल"
Budget 2021 Live : महिलांसाठी मोठा निर्णय; नाईट शिफ्टही करता येणार
"Budget 2021, Infrastructure: मुंबई-कन्याकुमारी कॉरिडोर; निर्मला सीतारामन यांची ११०० किमीच्या हायवेची घोषणा"
"Budget 2021, Automobile sector : जुन्या कारचं आयुष्य ठरलं, अर्थसंकल्पात 'व्हेईकल स्क्रॅप पॉलिसी'चा समावेश "
"आता मृत लोकांसोबतही करता येणार चॅटींग, विचित्र वाटत असलं तरी हे खरंच होणार आहे..."
"Budget 2021, Infrastructure: रेल्वे अन् मेट्रोबाबत अर्थसंकल्पात मोठी घोषणा; नाशिक, नागपूरमधील प्रकल्पांना मिळणार चालना"
"Budget 2021, Air India : टाटांकडून घेतलेली 'एअर इंडिया' सरकार विकणार; 'महाराजा'चं खासगीकरण करणार!"
अकोला जिल्ह्यात कोरोनाचे आणखी नऊ रुग्ण आढळले
सत्तेवर आल्यापासूनची मोदी सरकारची सर्वात खराब कामगिरी; ७२ टक्के जनता म्हणतेय...
"Video : रितेश देशमुख व जेनेलियाची धम्माल पार्टी, ‘झिंगाट’ गाण्यावर ‘झिंगाट’ डान्स 102"
बुलडाणा जिल्ह्यात गुन्हेगारीत ११ टक्क्यांची वाढ; पोलिसांची संख्या कमी
"लॉकडाऊनदरम्यान पंतप्रधान गरीब कल्याण योजनेची सुरूवात, ८० कोटी लोकांना फायदा : अर्थमंत्री"
" ओ भाई जी, गजब की स्पीड से लगे हो...! दुसऱ्यांदा बाप होताच कपिल शर्मा झाला ट्रोल129"
Budget 2021: देशात पहिल्यांदाच स्थापन होऊ शकते 'बॅड बँक'; अर्थमंत्री महत्त्वाची घोषणा करणार?
"मुलीच्या साखरपुड्यात राऊतांनी घेतली फडणवीसांची गळाभेट; चंद्रकांत पाटील म्हणाले, “दुष्मन असला तरी…”"
Budget 2021 Live : जुन्या वाहनांना भंगारात काढण्यासाठी Vehicle Scraping Policy लवकरच
वाशिम  जिल्ह्यात आणखी एकाचा मृत्यू;  २२ कोरोना ‘पॉझिटिव्ह’
कारंजा-अमरावती मार्गावर कार अपघातात एक ठार 
पुण्यातील वेताळ टेकडीवर आढळली ‘जंगली कॅट’ ; 'वाइल्ड लाइफ'साठी उपयुक्त
रेशन दुकानातून तूरडाळ गायब 
"Budget 2021, Healthcare Sector: कोरोनानं शहाणं केलं; आरोग्य क्षेत्रासाठीचं बजेट १३७ टक्क्यांनी वाढवलं!"
पंढरपूरचा पांडुरंग हा श्रीकृष्ण वंशाचाच वारसा
भिवंडीत गोदाम इमारत कोसळली ; आठ ते दहा कामगार अडकल्याची शक्यता
Budget 2021 Live : बँकांच्या बुडीत कर्जासाठी वेगळी कंपनी; वसुली करणारच : अर्थमंत्री
"Brushing Tips: रोज दात घासूनही पिवळेच दिसतात? मग वेळीच जाणून घ्या योग्य पद्धत, दुर्गंधीसुद्धा होईल दूर"
Budget 2021: बजेटबद्दल या गोष्टी माहिती आहेत का? प्रत्येकाने नक्की जाणून घ्याव्यात...
"लॉकडाऊनदरम्यान पंतप्रधआन गरीब कल्याण योजनेची सुरूवात, ८० कोटी लोकांना फायदा : अर्थमंत्री"
Budget 2021 Live : जुन्या वाहनांना भंगारात काढण्यासाठी व्हेईकल स्क्रॅपिंग पॉलिसी लवकरच
Budget 2021: 'या' नेत्याच्या नावावर आहे भारताचा सर्वाधिक अर्थसंकल्प सादर करण्याचा विक्रम! 
विराट कोहली- अनुष्का शर्मा यांच्या लेकीचं बारसं; बॉलिवूड अभिनेत्रीनं जाहीर केलं नाव
Budget 2021: लोकांनीच सांगितलं बजेटमधून त्यांना काय आहेत अपेक्षा?
"भंगार बस २ कोटीत, तर थकबाकी २० कोटींची "
नांदुऱ्यातील बनावट ऑनलाईन लॉटरी सेंटरवर स्थानिक गुन्हे शाखेचा छापा
"भरत जाधवने अंकुश चौधरीला अशा दिला वाढदिवसाच्या शुभेच्छा, पोस्ट केला त्यांचा जुना फोटो"
ऐंशी टपाल घरांमध्ये होणार ‘कॉमन सर्व्हिस सेंटर’
बुलडाणा जिल्ह्यात तयार होताहेत प्लास्टीकचे रस्ते
"BBL 10 : चूक अम्पायरची अन् सनरायझर्स हैदराबादच्या फलंदाजाला भरावा लागला अडीच लाखांचा दंड, Video"
कोल्हापूर विमानतळाच्या नामकरणाबाबत महिन्याभरात बैठक!
Budget 2021 : काय होणार स्वस्त? काय महागणार? जाणून घ्या...
पराभव दिसू लागल्यानेच मुश्रीफ यांच्याकडून वल्गना - राहुल चिकोडे
"म्यानमारमध्ये सत्तांतर, आंग सान सू की यांना अटक; एक वर्षासाठी आणीबाणी जाहीर"
बँक खात्यातून परस्पर काढलेली रक्कम मिळवून दिली परत
तिसऱ्या दिवशी किरणे मूर्तीच्या गळ्यापर्यंत अंबाबाईचा किरणोत्सव
"Budget 2021 : ""सर्व सामान्यांच्या अपेक्षा पूर्ण करणारा अर्थसंकल्प असेल"""
मूलद्रव्यांची दुनिया विविध भाषांत अनुवादित व्हावे :डी. टी. शिर्के
"Budget 2021| आज अर्थसंकल्पासह होणार हे 5 मोठे बदल, तुमच्यावर होणार थेट परिणाम216"
IPL Auction 2021 : मोहम्मद अझरुद्दीनसह १० अनकॅप खेळाडूंसाठी फ्रँचायझी पाडणार पैशांचा पाऊस!
"नागपुरात हुडहुडी, पारा १०.३ अंशावर"
Budget 2021 Live : यंदाचा अर्थसंकल्प 'हायटेक'; केंद्रीय मंत्रीमंडळाने दिली मंजुरी
बोंबला! 'नकली बेबी बंप' लावून प्रियकराच्या घरी पोहोचली तरूणी आणि पुढे जे झालं....
Budget 2021 : सर्व सामान्यांच्या अपेक्षा पूर्ण करणारा अर्थसंकल्प असेल - अनुराग ठाकूर
अच्छा सिला दिया तुने...!  ‘सिमरन’चा उल्लेख होताच कंगना राणौतची सटकली
नेत्यांविनाच बुधवारी होणार गोकुळची सभा
बेफिकीरीमुळे अकोला जिल्ह्यात पुन्हा उंचावतोय कोरोनाचा आलेख!
अखेर ११ महिन्याच्या प्रतिक्षेनंतर लोकल सेवा सुरू; पहिल्याच दिवशी प्रवाशांची तुरळक गर्दी187
Farmers Protest: “मी माझ्या जीवनातील २० दिवस दिले आणि सनी देओलनं माझी फसवणूक केली”
Budget 2021: बजेटच्या दिवसाची सुरुवात गोड; सेन्सेक्स ४०० अंकांनी वधारला
Budget 2021 Live : यंदाचा अर्थसंकल्प 'हायटेक'; राष्ट्रपतींची स्वाक्षरी घेऊन अर्थमंत्री लोकसभेत दाखल
